{
  "key": "busy_day",
  "displayName": "Busy Day — Stress Test",
  "description": "Three contracted arrivals in two sim-minutes, concurrent walk-ins, one tug refuelling. Tug Contract Nets compete.",
  "targetDailyRevenue": 12000,
  "randomSeed": 20260214,
  "settingsOverride": { "difficulty": "NORMAL", "autopilotEnabled": false, "realSecondsPerGameDay": 900 },
  "initialState": {
    "startDay": 1,
    "startTimeOfDay": "08:00",
    "wallet": 25000,
    "reputation": 60,
    "weatherOverride": { "windKn": 15, "visibility": "good", "swell": 0.5, "state": "sunny" },
    "berths": [
      { "berthId": 1, "occupied": false, "vessel": null },
      { "berthId": 2, "occupied": false, "vessel": null },
      { "berthId": 3, "occupied": false, "vessel": null },
      { "berthId": 4, "occupied": false, "vessel": null }
    ],
    "tugs": [
      { "tugId": 1, "status": "REFUELING", "fuel": 0.05 },
      { "tugId": 2, "status": "AVAILABLE", "fuel": 1.0 },
      { "tugId": 3, "status": "AVAILABLE", "fuel": 1.0 },
      { "tugId": 4, "status": "AVAILABLE", "fuel": 1.0 }
    ]
  },
  "contracts": [
    {
      "contract_id": "BD-503",
      "vessel_id": "BD503",
      "vessel_type": "container_vessel",
      "berth_id": "berth_2",
      "contracted_fee": 3000.0,
      "contracted_hours": 5,
      "expected_arrival_sim_millis": 120000
    }
  ],
  "events": [
    { "type": "Notification", "simTimeSeconds": 0, "severity": "INFO",
      "text": "Busy day: three contracted arrivals inbound, walk-ins expected. Tug 1 is refuelling." },
    { "type": "SpawnVessel", "simTimeSeconds": 30, "vesselType": "cargo_vessel", "channel": "contracted",
      "vesselId": null, "contractRef": "CONTRACT-1", "personality": null, "minPrice": null, "targetPrice": null, "etaSimMillis": null },
    { "type": "SpawnVessel", "simTimeSeconds": 75, "vesselType": "ferry", "channel": "contracted",
      "vesselId": null, "contractRef": "CONTRACT-2", "personality": null, "minPrice": null, "targetPrice": null, "etaSimMillis": null },
    { "type": "SpawnVessel", "simTimeSeconds": 120, "vesselType": "container_vessel", "channel": "contracted",
      "vesselId": null, "contractRef": "BD-503", "personality": null, "minPrice": null, "targetPrice": null, "etaSimMillis": null },
    { "type": "SpawnVessel", "simTimeSeconds": 300, "vesselType": "cargo_vessel", "channel": "walk_in",
      "vesselId": "WALKIN-B1", "contractRef": null, "personality": null, "minPrice": null, "targetPrice": null, "etaSimMillis": null, "vesselName": "Doria Vecchia" },
    { "type": "SpawnVessel", "simTimeSeconds": 300, "vesselType": "ferry", "channel": "walk_in",
      "vesselId": "WALKIN-B2", "contractRef": null, "personality": null, "minPrice": null, "targetPrice": null, "etaSimMillis": null, "vesselName": "Lanterna Rossa" },
    { "type": "TugRefuelComplete", "simTimeSeconds": 720, "tugId": 1 },
    { "type": "BerthFlood", "simTimeSeconds": 780, "berthId": "berth_2" },
    { "type": "SpawnVessel", "simTimeSeconds": 900, "vesselType": "tanker", "channel": "walk_in",
      "vesselId": "WALKIN-B3", "contractRef": null, "personality": "AGGRESSIVE", "minPrice": null, "targetPrice": null, "etaSimMillis": null, "vesselName": "San Giorgio" }
  ]
}
